id	text	T23
1862-06-03_article_0121	Gen. D. H. Hill 's division.;;; In the account of the engagement of Saturday on the Williamsburg road published in our paper of yesterday, we are informed that injustice was (unintentionally) done this admirable Division of the army.;;; The error was in representing Longstreet 's division as coming up at an early hour.;;; It did not arrive at the point occupied by Hill 's division to reinforce it until four or half-past 4 o'clock. Hill 's division had driven the enemy from his position on both sides of the road, had taken his camp, baggage, stores, and seven pieces of artillery, and was holding the ground against great odds and heavy firing when the famous division under Longstreet, led by Kemper 's brigade, as the advance, arrived and entered most gallantly into the fight very much to the assistance of the brave men who had driven the enemy and held them so long in check during their effort to recover lost ground.;;; Gen. Rhodes 's brigade, of Hill 's division, was in the thickest of the fight.;;; It went into the engagement with about 2,500 men, and of these 1,092 were killed and wounded in the desperate fight.;;; Gen. R.'s men fought like heroes.;;; The officers suffered much.;;; Gen Rhodes received a painful, though not serious, flesh wound in the arm. Philip T. Sutton, of this city, one of his aids, lost his left arm in the afternoon by a Minnie ball, after acquitting himself gallantly on the field.	0.7535566091537476
1862-12-29_article_0003	Milroy in the Valley.;;; This Yankee tyrant, who occupied Strasburg in the early part of last week, made but a brief so in the Valley.;;; Fearing that he might be in- he has again taken to the mountains of Western Virginia.	0.7535073161125183
1861-10-07_article_0006	The late engagement at Lewinsville — a Correction. Messrs. Editors:;;; In your paper of a recent date a correspondent from Fairfax C. H., in giving an account of the fight at Lewinsville on the 25th ult., fails to do justice to the First Regiment of Regulars from Georgia.;;; That fine body of soldiers, under command of Lt. Col. Magill, arrived on the field early in the engagement, and for a considerable length of time received a terrible fire of shot and shell from the enemy's batteries.;;; Throughout the entire engagement and subsequent pursuit, they evinced undaunted courage and heroism, and deserve to be honorably mentioned in connection with that expedition.;;; The following regiments were present:-- Kershaw 's Third South Carolina, Seventeenth Virginia, First Regiment Georgia Regulars, and Ninth Georgia Volunteers. One Who Was Present.	0.7525825500488281
1864-07-11_article_0024	From Petersburg. Petersburg, July 9.;;; --All quiet this morning in front.;;; [ Second Dispatch.] Petersburg, July 10.;;; --About 5 o'clock on Friday evening our artillery along the whole line opened upon the enemy, and at the same time our men mounted the breastworks and defied the enemy, who sought the cover of their entrenchments and replied with artillery.;;; The firing lasted about thirty minutes. The enemy have made no assault on our lines for a week past, and the impression prevails that the enemy have drawn off their force from our front.;;; For several nights the rumbling of artillery and wagons has been distinctly heard all night for each night.;;; The enemy, however, still keep up a show of force along our entire front.;;; All quiet to-day.;;; Official.	0.7522621154785156
1861-07-09_article_0059	The Charleston Courier learns that two more regiments will be ordered from South Carolina to Virginia in a few days.	0.7522132396697998
1862-07-19_article_0006	New Jersey troops.;;; --The 3d and 4th regiments suffered much more than the 1st and 2d.;;; The 4th even worse than the 3d, as nearly all were killed, wounded, or taken prisoners.;;; There is no 4th --all that remain are with the 3d believe they number about forty effective men. -- Correspondence Phil, Inquirer.	0.7519941926002502
1860-11-07_article_0106	"The battle on Greenbrier River.;;; interesting particulars — the strength of the enemy — Gallantry of our troops — cowardice of the enemy, &amp;c.;;; [Special Correspondence of the Dispatch.] Camp Bartow, Greenbrier River,Pocahontas Co., Oct. 8, 1861.;;; Doubtless you have received the details of the decided victory we gained over the enemy at this post on Thursday last, and I propose now to give you a few incidents of the battle:;;; The enemy in sight.;;; About 7 o'clock our pickets, under command of Col. Ramsey, of the 1st Georgia regiment, discovering a large force of the enemy coming down the mountain, immediately fired into them, and held them in check for a long time, and then retreated in good order to camp.;;; The enemy, finding that our pickets (about 200 men) behaved so bravely, tired into them with cannon — a most cowardly act, and one unheard of in civilized warfare.;;; The enemy then advanced to an open field, ( 7,000 strong,) placed six cannon in position, and commenced a rapid fire into our encampment, and, after receiving five or six rounds, Captain Shumaker opened on them with his battery, Captain Rice joining in with his pieces, and for four hours and a quarter an incessant cannonading was kept up. In the meantime the infantry of the enemy tried to outflank us on the left and right; but, to their surprise, they found that the Arkansas regiment was ready to receive them, and therefore retired, the Arkansans cursing that they would not come close enough for them to get a shot; on the right, they were equally surprised at finding the 1st and 12th Georgia regiments ready to receive them, and did not venture near them, although the Georgians told them they would not fire on them until they could get in the open field, the enemy then being in the woods and covered by trees.;;; The enemy retreated in double-quick time after they found they could not out flank us, leaving a large number of wounded and dead on the field.;;; Our loss in this engagement was seven killed and missing, and twenty-one wounded. Their loss is estimated at between one and two hundred killed, and a large number wounded.;;; Great credit is due to Capts. Shumaker and Rice and their brave men, for the gallant manner in which they handed their beautiful little pieces.;;; We regret that Capt. Rice had his foot shot off, which had to be amputated.;;; He is now improving slowly.;;; We cannot particularize instances of bravery, but Capt. Rice acted ""well his part."" In fact, all the troops behaved with the utmost coolness and bravery.;;; Capture of their flag.;;; The Arkansas regiment captured the "" Stars and Stripes,"" the flag of the enemy, a beautiful silk one, and brought it to camp.;;; The staff had been shot off, and the flag has been sent to Richmond.;;; Colonel Ramsey.;;; Colonel Ramsey was in command of the pickets, and was cut off from them, after having his horse shot from under him, and, he being lame, was forced to take to the woods, and was in the rear of the enemy during the battle, and says he counted twenty-five wagons full of dead and wounded that passed by him, and that for a mile the road was covered with blood.;;; Colonel Ramsey displayed great courage with his pickets, and they nobly sustained him in his efforts.;;; The charge.;;; During a portion of the battle, the enemy upon the right was called upon to charge on the Georgians by the commanding officer; but ""nary"" charge could be got out of them.;;; The following dialogue was distinctly heard by our troops:;;; The Yankee officer to Colonel.-- ""Why in the h-- 11 don't you charge on them?;;; Haven't you heard the order?"";;; Colonel.-- ""Yes; but they won't do it, and I'll be d — d if I can. I can't carry them on my shoulders."";;; Man in the ranks.-- ""Pay us, and we will fight."";;; Our Hospital.;;; Before the fight commenced a white flag was placed over a house containing a number of sick men; but, instead of humanely keeping their shot from, they fired incessantly at it, and one or two balls passed completely through the building, but luckily without hurting any one.;;; Such cowardly conduct is in keeping with the miserable tool to whom they belong.;;; Horse and kitten.;;; During the cannonading, Col. Taliferro 's horse, a very fine bay, was tied by our entrenchments, and the old fellow being asleep, a bombshell bursted right over him; he mere by raised his head, looked around, and then turned to his former position, as if in utter contempt of the parties from whence it came.;;; A little kitten, belonging to a company of the 23d, during the engagement, was seen running along the entrenchments, and whenever a ball struck near it and raised the dirt, the little thing would jump and gambol around it in playful glee.;;; The wounded.;;; I cannot give you the names of all the wounded, but all of them are doing well.-- Private Gus. A. Rhineheart, of the Richmond Sharp-Shooters, received a very severe wound on the top of the head by the bursting of a shell, and was insensible for three days, but he is improving rapidly.;;; Another attack.;;; Some seem to think that the enemy will attack us again, and others that they will not: but should they call to see us, they will find us at home, better prepared-to give them a specimen of Southern hospitality.;;; Ned."	0.7515522837638855
1860-11-07_article_0106	"Was the South ever Dependent on the North ?;;; -- The Rev. Henry Ward Beecher. during the last year, delivered one of his characteristic tirades against the South, from which we make the following extract:;;; "" Is the South Dependent! --The little finger of a Northern man is worth more than the whole body of a master with whip in hand, and head on which he seems to use for little else than to hang his hat upon.;;; These threats of of the South to secede are like the meeting of paupers in an alms-house, and resolving to quit the institution if the country does not feed them better.;;; The South sucks the Northern bosom and we fill it with milk.;;; We work, and they reap the fruit of our toil.;;; We invented the means of their prosperity.;;; Whitney made the cotton gin that has done so much for the South, and he died a poor man, as they cheated him out of the reward of his toil.;;; Chivalry! Chivalry!"";;; The persistent folly of men like Beecher, who actually believed what he here asserts, that the South was dependent for its very existence on the North, and that she could be induced by no consideration of interest or self-respect to dissolve the bands that connected them, had a tendency to hasten the catastrophe, which was inevitable under any circumstances, more than anything else that occurred during the long war of recrimination that preceded it. In view of the actual facts, it seems strange to us how such infatuation could ever have fastened itself upon the minds of men who have been supposed, above all others, to act habitually from the promptings of interest.;;; While Beecher was thus in flaming his Yankee audience against the Southern people, and deluding them into the belief that separation was impossible, the train had already been laid, and the match lit. In a few weeks the Union was blown sky-high, and his miserable dupes have only learned, when it was too late, the utter hollowness of his cause.;;; The North has lost the trade of the South forever, and we shall now have a fair opportunity to see which of the sections can best dispense with the assistance of the other.;;; It is not even necessary to wait the slow progress of time: we already know what the North drew from the South, and what she was able to supply from her own resources.;;; The entire exports of the whole Union amounted in value annually to about $325,000,000. Of these the South exported in round numbers $250,000,000 in cotton, tobacco, rice, sugar, and naval stores.;;; Nearly the whole of this exportation went to Europe, and was paid for, not in gold and silver, but in silks, broad-cloths, wines, and other manufactures.;;; When these articles thus purchased arrived in port, they paid a duty of 25 per cent., amounting in round numbers, to $30,000,000. The South owning three - fourths of the importation, paid three fourths of the duty, or $60,000,000. In other words, since the Government was supported almost entirely by duties upon imports, she contributed three - fourths of the money required.;;; The North contributed but one - fourth --that is, $20,000,000. It can be seen at a glance by whom the Government was chiefly supported.;;; The North had a population of 20,000,000, the South a population of 10,000,000.;;; If the Government had depended for support on direct taxes equally and uniformly laid according to population, the North would have paid twice as much as the South; that is to say, she would have paid $54,000,000, while the South paid $26,000,000. The system adopted made the South pay $60,000,000, while it exacted from the North only $20,000,000.--Which party was dependent upon the other?;;; The Black Republicans say that the North paid the largest amount of duties, because it used the largest amount of imported goods.--The latter part of this proposition is true, the first false.;;; The North certainly consumed two thirds of the imported goods, but those goods were the property of the South when the duties were paid on them.;;; After the duties were paid, the South, not having a use for more than one - third of them, the New York or other Northern merchants took the other two - thirds.;;; From the sale thus made, the South paid broker's expenses, and received, in lieu of money or foreign goods thus sold, a portion of New England manufactures.;;; Out of the value sent abroad-- $250,000,000 --the South paid $60,000,000, or one - fourth of the whole in duties-- $50,000,000 more (that is 20 per cent.,) in commissions to brokers and importers in New York and Boston -- $20,000,000 to the Yankee manufacturer, in the shape of profit on his manufactures, sent to the South in place of the imported goods — and $10,000,000 to the Yankee shipper, who carried these goods, foreign and domestic, to Southern ports.;;; After all this, the Southern man generally spent his summers at the North, and there got rid of at least $60,000,000 more of what was left him after these successive exactions.;;; A writer who is not often mistaken in matters of this sort, says that the South annually paid to Northern manufacturers, merchants, importers, brokers, shippers, and hotel-keepers, sums amounting in the aggregate to $231,500,000.--It is easy to understand how their splendid cities, railroads, and canals were constructed.;;; Mr. Beecher is in a fair way to have the truth of his propositions thoroughly tested, as they have already been partially.;;; The South has separated herself from the North, notwithstanding his prediction to the contrary.;;; She will try whether she can exist independently of the North, and we shall see whether the North can live independent of her. The $231,000,000 which she had annually from the South will hereafter be spent in the South.;;; We shall see whether it will not, in time, build cities, construct railroads, and dig canals, as magnificent as any of which the North can boast.;;; We shall see, also, whether we cannot get our cotton, tobacco, rice, and sugar to Europe without the assistance of the Yankees.;;; Let not the Rev. Henry Ward Beecher fear that we will hereafter be a burthen to Yankeedom.;;; If we have been dependent on her heretofore, we never will be hereafter."	0.7515522837638855
