id	text	T23
1861-10-30_article_0091	"A good one.;;; -- One of the Federal officers captured in the battle of Leesburg, declares that hundreds of the prisoners taken at the same time are ""d — d deserters, who threw themselves in the way of the conquering foe,"" ""for,"" says he, ""there are more prisoners here than the whole command could have afforded."" This may account for the small loss reported by the enemy.;;; Of the number sent out they acknowledge a loss of only two hundred.;;; As to the deserters, they have nothing to say."	0.9534972906112672
1861-07-03_article_0179	Movements of Missourians. Independence, July 1.;;; --Intelligence has been received here announcing that 10,000 Missourians are encamped about one hundred miles below this point, and are there preparing for an advance.	0.9249727129936218
1862-08-06_article_0013	The 10th Virginia cavalry;;; were not engaged in the picket fight on the South Side, in which our cavalry fell back, as stated yesterday.	0.9113581776618958
1864-02-27_article_0034	Fighting in Northern Georgia.;;; We understand that an official dispatch was yesterday received confirmatory of the press dispatch in reference to fighting along the outposts between the advance of the two armies in Northern Georgia.;;; It is not believed, however, that a general engagement is probable.	0.9034462571144104
1864-02-17_article_0006	Corse 's brigade.;;; --The 17th and 30th Virginia regiments, in this brigade, are re-enlisting by whole companies.;;; There is no doubt that the whole brigade will re-enlist.	0.902480125427246
1863-07-22_article_0038	The Wounded Soldiers at Camp Winder are, to all appearances, doing well, so that many of them will be ready for the field in a very;;; Telegraphic News.	0.9024615287780762
1863-09-21_article_0093	Back again.;;; --The monitors are back again before Charleston, having suffered nothing from the late storm.;;; In the meantime, it is to be presumed Fort Sumter has been strengthened, and is ready to repel any attack the Yankees may make on it. They can take it in no other way than by storm; they have done all that can be done by cannonading.;;; They must assault it, or go without it, and they cannot take Charleston until they have taken Sumter.;;; Even then their work will but have begun.	0.8878092765808105
1862-01-17_article_0121	"The occupation of Remey.;;; By way of confirming the reports in relation to the evacuation of Romney by the enemy, and its occupation by our troops, we may state that a letter was received from the Valley of Virginia last evening, which says-- "" General Jackson has taken Romney, with out a shot."""	0.8858027458190918
1864-06-18_article_0017	From North Georgia. Three Miles this side of Marietta, June 16.;;; --There was little skirmishing by the enemy on our batteries yesterday, and scarcely any replying.;;; Sharpshooters were firing all day. The most of the wagons of the enemy were moved in front of the locality occupied by them yesterday.;;; During the skirmishing yesterday Major Massey, of the 20th Mississippi, was killed.;;; At five o'clock yesterday afternoon Hooker 's corps made a charge on Cleburne 's division in three lines of battle, and was repulsed with great slaughter.;;; A few prisoners were taken, who confirm the above.-- Cleburne 's division fired 315 times with shot, shell and canister.;;; The enemy was not able to bring his artillery to bear.	0.8850172162055969
1862-02-10_article_0030	The Thirteen Virginia Regiment.;;; --This patriotic regiment of volunteers will results for the war. Nearly every man and officer has signified an intention to hold his place until the foe is driven from our soil.	0.8831372261047363
1861-09-03_article_0068	The Washington Artillery, of Georgia, quartered at Pensacola, have purchased a handsome Georgia-made sword, and intend to present it to that brave soldier, Gen. W. H. T. Walker, now in Virginia.	0.8646113276481628
1864-07-26_article_0044	From Georgia. Atlanta, July 25.;;; --There has been continuous skirmishing for the past two days. Many from the enemy's batteries have entered the city, and a few houses have been struck, but no material damage has been done.;;; The enemy's extreme right endeavored to gain possession of a commanding eminence between their and our lines, but were repulsed by the 11th Texas regiment.;;; All quiet this morning.	0.8569378852844238
1862-03-25_article_0069	In the evacuation of New Madrid all the mounted guns were spiked and abandoned.;;; A portion of the ammunition, most of the baggage, and about 100 mules, were all left behind.;;; All the men, except a few pickets, were brought off safely.	0.8546228408813477
1861-02-13_article_0213	The Entire Military Force of this country is estimated from late, but imperfect returns, 3,168,000, of which about 2,500,000 are infantry, cavalry 20,000; artillery 13,000; riflemen 20,000.	0.8509048819541931
1861-04-19_article_0111	Salute from Maryland.;;; -- Fifteen guns were fired last Tuesday night in Funkstown, Md., in honor of the Southern victory at Fort Sumter.	0.8454495668411255
1863-11-12_article_0003	Retreat of the Yankees from Green Brier.;;; The latest report from Averill in Greenbrier states that he was retreating and our forces were slowly following.;;; The loss of Gen. Echols in his engagement on Thursday is put down by one writer at 150 and by another at 300, most of them missing, and many having come in since the fight.;;; The engagement was mainly an artillery duel, and there were not many killed or wounded on either side.	0.8448248505592346
1861-08-03_article_0140	Second Mississippi Regiment.;;; --This regiment had 31 killed and 82 wounded in the great battle.;;; Col. Faulkner received a slight wound by the explosion of a shell	0.8422741293907166
1862-01-08_article_0106	Defence of the Western Frontier.;;; We learn with pleasure that, in addition to other troops, the War Department has ordered back one of the regiments of Gen. Floyd 's command that had departed for Kentucky to the region of country threatened by the enemy.;;; It is further stated that a cavalry regiment has been ordered to the same point.	0.8418624401092529
1861-04-24_article_0116	Fort Pickens.;;; --A report, which lacks confirmation, has reached us that Fort Pickens has been captured by the Southern army, after a desperate fight and a heavy loss of life.	0.8346395492553711
1863-09-21_article_0103	From Gen. Lee 's army.;;; --Yesterday we had an abundance of rumors, but very little information from the army of Gen. Lee.;;; It was asserted with some degree of confidence by those who pretended to be informed that a general fight had commenced on the line of the Rapidan.;;; It is not at all improbable that heavy skirmishing took place yesterday.	0.8312296867370605
1863-04-21_article_0023	Advance of Yankee cavalry on Pontotoc, Okalona, April 20.;;; --A sqardron of Abolition cavalry, estimated at 1,500, were advancing on Pontotoc, yesterday.;;; The advance guard reported there last night.;;; Our forces are concentrating to resist them.;;; An engagement is contain to-day unless the enemy retired.;;; Dissolutions and Copartnerships.	0.8282834887504578
1862-10-14_article_0003	Fight them with Rocks.;;; --A member of the 15th Alabama regiment, writing about the battle of Sharpsburg to the Columbus (Ga.) Sun, says:;;; After using up all our ammunition, we asked to retire find fill our cartridge boxes, but General D. H. Hill would not let us do so; ordered us to hold the position, without a single cartridge, and to fight them with rocks! We were in an open field, exposed to a cross fire of artillery and a front fire of small arms, and had to like and take it.	0.8272477388381958
1863-09-28_article_0082	The enemy in Western North Carolina.;;; --The enemy are reported to be advancing in force towards Morgan, N. C. Colonel Avery's plantation has been destroyed and his stock driven off.;;; Telegraphic news.	0.8257755637168884
1862-05-09_article_0070	The 71st Ohio regiment had their colors taken from them after the late battle for cowardice on the field.;;; They have been sent to garrison Fort Donelson.;;; Lost, Strayed, &amp;c.	0.8253294825553894
1861-06-03_article_0024	Fort Pickens.;;; --A letter has been received in Lynchburg from Pensacola.;;; The writer is of opinion that Fort Pickens cannot hold out against the Confederate forces for more than twenty-four hours, as Gen. Bragg has erected batteries that will enable him to throw so many shells into the works every minute, that the garrison must be smoked cut, even if the casemates are not destroyed.	0.8246737122535706
1862-04-19_article_0121	The Shiloh battle.;;; An official dispatch received yesterday from Corinth, states that the reports of the several commanders show that in the engagement at Shiloh our troops captured and brought in fourites places of the enemy's artillery, and twenty-five stand of colors.;;; The number of prisoners taken exceeds three thousand.	0.8235429525375366
1862-08-05_article_0001	The lines below Richmond.;;; Lieutenant-Colonel L. S. McGruder, commanding the 10th regiment of Virginia Cavalry, now on picket near White Oak Swamp, having learned on Sunday that the enemy was occupying Forge's Bridge, sent towards that point a small scouting party, under command of Lieut. Tichenor, of Richmond.;;; The Lieutenant scouted as far as the bridge, bringing back with him two prisoners. The Yankees had left the bridge on Friday last.;;; The pickets also captured one prisoner the same day. They were all brought to Richmond on yesterday, and handed over to Gen. Winder.	0.8227689862251282
1863-05-04_article_0020	The battle at Grand Gulf, Miss.;;; heavy fighting — the enemy repulsed — loss heavy on both sides. Jackson, Miss., May 1.;;; --The enemy advanced and fighting commenced at Grand Gulf this morning at 1 o'clock, and continued until 4, when the enemy was repulsed.;;; The battle was renewed at 8 o'clock.;;; The Yankees captured Wade 's Virginia Battery, which was retaken by our troops this evening.;;; The enemy has been driven a mile from the battle-field, and firing has ceased.--Loss heavy on both sides.;;; General Bowen 's horse was struck four times in a charge on the enemy.	0.8201319575309753
1862-07-31_article_0005	The flag of Truce to day.;;; As heretofore announced, it was contemplated to-day to send 800 of the wounded Yankees remaining here to their homes, but it is probable that they will not start as designed, a telegraphic dispatch having been received from Major-General D. H. Hill yesterday that the City Point railroad was in want of repairs, and that they would have to be made before any more of the prisoners could be transported over it.	0.8189404010772705
1860-11-07_article_0107	"Emancipation the object.;;; --Beaten and disgraced, smarting under the ridicule of the world, afraid to confront us further in open field, despairing of success in conducting the war upon any other pretext, the Yankees, in their rage, madness and folly, have now determined to play their last card, and to make of this in pretext at least, an anti-slavery war. This is the meaning of their raids upon our Southern coast.;;; They are afraid to meet us on land; they mean to employ against us all the resources of their navy, and they must needs excuse their projected robberies, ravishments and petty thefts along our seaboard, upon the convenient plea of liberating our slaves.;;; The South may be slow to believe that they have determined to convert the war into an anti-slavery crusade; but foreign eyes are better detectives than ours of purposes of this sort, for it is to foreigners they unfold their plans, pleas, and excuses.;;; ""The latest letter of Lord John Russell declares that the issue is narrowing down to the question of slavery and abolitionism, and expresses the opinion that President Lincoln will soon declare all slaves within the United States free."";;; Fremont, the lieutenant of Lincoln in Missouri, has anticipated his chief in respect to that State, and the chief has publicly given out that he cordially concurs in the Missouri proclamation.;;; The telegraph announces that the greatest activity is discernible in the Washington Navy-Yard, and a war organ in Cincinnati boasts that ""the next we know, a mighty fleet, with ten thousand men aboard, will open one of our cotton ports; that the profound repose which the Southern coast and the nests of conspirators in the Cotton States have been permitted to enjoy, will soon be seriously disturbed."";;; Nothing is plainer than that a change of the theatre and plan of the war is absolutely necessary to a change of its fortunes in their behalf; and that the sole possibility which remains to them of preventing the active sympathy of European powers with our cause, is the conversion of their otherwise insane war into an anti-slavery crusade.;;; Their refusal of the challenge of our Generals before Arlington and Alexandria, and their assumption of a defensive attitude everywhere, from Maryland to Missouri, proves clearly enough that they have, at least for the present, abandoned the ""on to Richmond "" and ""on to Memphis "" programme.;;; Their plan of campaign is now to be a petty system of annoyance and theft along our seaboard, withheld and there a formidable demonstration against an exposed port or supposed depository of cotton.;;; In these raids they will ply themselves industriously to all sorts of theft, and will endeavor to sanctify and justify their contemptible larcenies in the eyes of the world by introducing Coffee into the case, and stealing negroes, along with pigs, chickens, grain, live stock, and household and kitchen furniture.--The righteous act of stealing a negro will be made to cover a multitude of sins and felonies contemplated in their new programme.;;; They are committing acts of tyranny now in their own States which shock modern civilization and throw the enormities of Bomba into the shade.;;; These outrages and whatever acts of absolutism and tyranny their tippling hero, McClellan, commissions on men and women in his drunken fits, must be excused to the piety of the world on the hypocritical but sufficient plea that the war they are engaged in is against slavery, and that the victims of these outrages are doubly deserving of their doom as traitors to the Union and as aiders and abettors of the damnable institution.;;; Their policy henceforth is to be a policy of cowardice and cruelty North and South.;;; They will send grand armaments to make attacks only when there will be the certainty of a feeble resistance, the doings of which will be heralded as brilliant feats of arms.;;; Regular operations in the field they will no longer dare to conduct: and they will endeavor to distract attention from their inactivity on land by naval expeditions magnified by their newspapers into quadruple proportions.;;; It will not be very long before they ingloriously stampede from Washington city, leaving to our army its spacious palaces of marble for winter quarters; and doubtless the grand armament for the sea, concerning which their newspapers are significantly boasting, is intended to create a diversion of the popular mind from that ignoble hegira.;;; It cannot be denied that the resort to the anti-slavery pretext is a necessary expedient to the Government at Washington.;;; What violence can they not practice upon refractory spirits at home in the name of abolitionism?;;; What ignominious defeats can they not successfully rally from under the fanatical banner of anti-slavery?;;; What acts of meanness, cowardice, butchery, rape, theft, and arson can they not inflict with Christian impunity upon the South under the cry of down with slaveholders and slavery?;;; Such is to be the programme and such are to be the shibboleths with which the South is to be assailed.;;; To be forewarned is to be fore armed.;;; We must prepare to resist their raids at all points; and we must anticipate and prevent them by carrying the war to their own doors."	0.8175281882286072
1860-11-07_article_0107	Another account of the battle on Greenbrier River. Camp Bartow, Greenbrier River,Pocahontas Co., Oct. 4, 1861.;;; Editors of Dispatch: Almost are the rattle of the enemy's artillery in full retreat is silenced by distance, I find myself endeavoring to communicate to you the facts and particulars of our little engagement with the Yankees, on yesterday, 3d of October.;;; At about 6 o'clock A. M. a messenger from our pickets reported the enemy advancing in full force, with cannon, wagons, and every thing necessary, and indicative of an immediate attack.;;; Two companies were promptly dispatched in double-quick time to sustain our pickets, and check their advance until our camp was put in a thorough state of defence.;;; In less than thirty minutes we were ready to receive our enemy with — not open, but loaded arms.;;; At 6 o'clock and 45 minutes our whole force of pickets — probably two hundred --holding an advantageous position in a short bend in the road, about one mile from camp, and under the immediate command of Col. E. Johnson, poured such a full and steady charge of musketry into their ranks as to confuse and scatter the whole column.;;; Lieut. J. G. Gibson deserves to be mentioned here, (officer of the picket,) as being cool and calculating equal to any emergency.;;; In this fight with our pickets, who were only driven back by a flank movement of the enemy, and in the thickest of which the intrepid Johnson was constantly seen, we lost, in killed and wounded, five men.--Our pickets being at last compelled to fall back from post to post, merely escaped behind our entrenchments, in a perfect shower of grape and canister.;;; All of our available pieces, five 6 -pounders, including one rifle piece, was immediately opened upon those of the enemy, eight in number, including one 12 -pound howitzer.;;; For six mortal, rather immortal, long hours these terrible engines of war replied to each other so furiously as to drown effectually the continuous rattling of musketry, Capt. James Deshler, temporarily in command of a detachment of Capt. P. B. Anderson 's ( Lee) battery, proved himself an excellent marksman.-- Capt. Shumaker, and the accomplished, brave Massey, rendered service, also, of the greatest importance.;;; The tried old veteran, Capt. Anderson, had two pieces, supported by Capt. Sam. Reid, in what our best engineers considered the most important position; but, owing to the fine disposition of our infantry, was not in action at all. The old Captain, also Capt. Sam., regretted their disposition extremely, and were only aggravated by bursting shells and whistling balls that they could not reply to. At 11½ o'clock three regiments were ordered to flank us in the woods, on the left.;;; A mortal foe, the Arkansas 3d, divided, under Col. Rust and Lieut. Colonel Barton, like so many spirits called up for the occasion, easily drove back the vandals in the face of fierce showers of grape, which, cutting through the branches of pine trees, fell far beyond, or lodged overhead without doing even the least injury.;;; Unsuccessful in executing a left flank, they fell back beyond musket range, but could not evade the range of our cannon, which dealt death in their confused ranks profusely.;;; Desperate, defeated in all but name, they made a last bold effort to flank us on the right.;;; The First Georgia leaped from their entrenchment, met, and gallantly repulsed them.;;; Their 12 -pound howitzer being crippled, which, added to their ill-success in flanking, the galling fire of our well-aimed pieces, and their natural cowardice, caused them to withdraw, carrying with them some 20 wagon-loads of dead and wounded.;;; They were, probably, 6,000 strong, and lost at least 300 killed and wounded. We were considerably the weaker party, and lost, killed and wounded-- I know to a certainty --not exceeding 18. Capt. Reld, of the 3d Ark. volunteers, lost one -- Wm. O. Blocker — killed, and one -- John G. Carter — missing.;;; They were pickets, and never did braver boys die more gallantly, Blocker continuing to load and shoot after being shot through the jaw, could not be prevailed on to withdraw to a safe place, was found today immediately in the road, whose body was at least a monitor to the murderous souls of our enemy of a fact they ought by this time to realize, that many such brave and noble youths will block their passage to our homes.;;; Peace be with you, my friend — a better, braver boy never met a more honored fate.;;; We fear the worst for our follow-soldier from Kentucky, J. G. Carter, We will, however, yet hope to see him return, believing an All wise providence favors the brave and just, and that our esteemed friend has not fallen, but will yet turn up, probably now lost in the mountains.;;; Special couriers from Huntersville state that the main den of the Yankees — Huttonsville --is certainly in the possession of our troops.;;; I believe no one in our camp doubts it, for heavy cannonading has been heard in it, for heavy cannonading has been heard in that direction all day. We are expecting an attack momentarily, and are fully prepared to welcome them again warmly.	0.8175281882286072
1862-12-31_article_0023	Heavy fighting in the Southwest. the enemy repulsed! a flag of truce to bury their dead. Vicksburg, Dec. 30.;;; --On Saturday the enemy made four desperate attempts to force our lines on the Chickasaw, with heavy loss.;;; The 17th Louisiana greatly distinguished itself, repulsing, unaided, the assault of three full regiments of Yankees.;;; On Sunday morning the enemy again advanced on our lines, and were repulsed with heavy loss. --All the troops behaved gallantly, but special mention is made of the 28th and 17th Louisiana regiments, the former regiment maintaining the ground all day against superior forces.;;; Our loss on Sunday was: the 17th Louisiana, 1 killed and 2 wounded; 8th Tennessee, 4 killed and 6 wounded, Capt. C. A. Gently among the killed; the 17th Tennessee, 2 killed and 2 wounded; 81st Tennessee, 1 killed, none wounded.;;; One of Gen. Lee 's couriers had his leg shot off. Wofford 's artillery lost one Sergeant killed.;;; No particulars of the casualties in other regiments.;;; On Monday afternoon 8,000 of the enemy advanced on one of our regiments on the right wing of the Chickasaw Bayon to storm the works, but were mowed down in large numbers, and upwards of 400 prisoners taken, with five stand of colors.;;; The enemy were driven back to their boats, and afterwards sent in a flag of truce for permission to bury their dead, under which some of the prisoners escaped.;;; Fighting still continues, with no important results.;;; The fighting of our troops was splendid.;;; The 28th Louisiana again immortalizes itself for the gallant manner in which it acted during the battle.;;; The Yankee prisoners state that Morgan is their General commanding.;;; Severe fighting is going on now.;;; The enemy have destroyed the Vicksburg, Shreveport and Texas Railroad as far as Delhi, La, a distance of 38 miles. They are also said to have burned the town of Delhi, which is reported to be totally destroyed.;;; Our casualties in yesterday's fight were small.;;; This morning firing is heard in the same direction, and it is supposed the enemy are again advancing to storm our works.;;; The soldiers are eager to meet the enemy, and are determined to conquer or die.	0.8173621296882629
1861-12-30_article_0046	Defensive Preparations.;;; --Another superior field battery, including one rifled piece of novel construction, and some fine twelve pounders; has just been sent to Yorktown, so strengthen the defences on the Peninsula.	0.8127012848854065
1862-06-07_article_0158	The casualties.;;; We are are unable to complete the publication this morning of the reports of killed, wounded, and missing in the battles of Saturday and Sunday.;;; Among those that we are compelled to postpone are the 11th Alabama, 7th Tennessee, and 57th Georgia regiments.;;; In the last named there were 16 killed, 129 wounded, and 9 missing --making an aggregate of 154.	0.8059695363044739
1863-05-16_article_0019	The wounded and sick.;;; --It appears from official data that 7,100 wounded men have been brought from Chancellorsville to Richmond.--Since that battle 1,900 sick have also been sent to Richmond.;;; It is expected that during the next thirty days one-half of the wounded will be able to return to duty.;;; In the battle the proportion of slightly wounded to those fatally injured greatly exceeded that of any previous contest between the Confederate and Abolition troops.	0.8038480877876282
1863-11-24_article_0014	Fighting commenced at Chattanooga — our pickets Driven in. [from our Own correspondent.] Mission Ridge, Nov. 23.;;; --The enemy massed a very heavy force on our right this morning, and advanced at 2 o'clock, driving in our pickets.;;; It is not certain yet whether they intend an attack in force or to advance their lines. Sallust.	0.8031792044639587
1862-06-24_article_0004	The fight on James 1st.;;; And.;;; --It has been ascertained that the enemy's loss on James Island is much larger than at first reported.;;; Up to Wednesday evening 251 bodies had been interred by our men and their ambulances were allowed to remove their wounded.;;; The probability is that their loss in killed, wounded, and prisoners, will reach one thousand.	0.801607072353363
1864-10-20_article_0049	The dead Coming to life.;;; --It is stated that, since the order to mount Lewis 's Kentucky brigade, in Hood 's army, was made the brigade has been largely enhanced in numbers.;;; Many soldiers of the brigade who were supposed to have been killed long since in battle have come forward to resume their places in the command.	0.7989811301231384
