id	text	T23
1864-06-20_article_0030	From North Georgia. Three miles West of Marietta, June 17, 1864.;;; The enemy made an attack in three lines of battle yesterday, on our extreme left, near Lost Mountain, and were received with a terrific volley of artillery and musketry.--They were driven back by our forces, and their dead strewed the ground from which they had been driven.;;; The fight occurred at 2 P. M., and full accounts are not yet received.;;; The enemy cannonaded our works in the centre of our lines furiously.;;; Both lines remain substantially the same as yesterday.;;; The enemy continue firing.;;; They attempted to shell our signal corps on Kennessaw Mountain, but could not reach the top of the mountain.;;; [ Second Dispatch.] Three Miles West of Marietta, June 18.;;; --The enemy has moved a large number of his forces on our left.;;; Cannonading and musketry are constant, amounting almost to an engagement.;;; The rain still continues, which renders the roads unfit for military operations.;;; The indications on our left and centre are that they will be attacked.;;; Our army is in splendid spirits and ready for the attack.;;; Deserters came in this morning, drunk.;;; There were but few casualties yesterday on our side.;;; Several prisoners were captured this morning.;;; Marietta, June 18. --Rain has been falling heavily and incessantly a greater part of last night and all this morning.	0.7966435551643372
1861-07-11_article_0156	Alive and stirring.;;; --The streets were thronged with civilians and soldiers yesterday.;;; Several companies of the latter came into town, and one or more regiments deployed through the main avenues.;;; The people were alive and stirring yesterday.	0.7951739430427551
1863-06-18_article_0007	Skirmishing on the Blackwater.;;; The Federals, several thousand strong, with cavalry, artillery, and infantry, attempted to force a passage across the Black water, at Joyner 's and Black water Bridge, on Monday night, but were repulsed.;;; Tuesday evening they opened a heavy fire upon Franklin, with artillery and a regiment or more of rifles, keeping up a severe fire for two hours, at short range.;;; They were again repulsed.;;; The Confederate commanding officer did not use his artillery at all, but only the men in the rifle pits.;;; A good many of the enemy were killed.;;; No loss on our side.	0.7941116094589233
1863-05-25_article_0034	From the army in Tennessee. Tullahoma, May 23.;;; --The rumor of the capture of two of our regiments in front with one piece of artillery, is not true.;;; The enemy did surround and capture a small outpost of some forty men. All quiet in front.	0.7929977774620056
1864-03-01_article_0033	Another Exploit of Mosby.;;; The following official dispatch was yester day received at the War Department:;;; Orange C. H., Feb. 28, 1864. Brig. Gen. G. W. C. Lee, President 's Staff:;;; Col. Mosby has just accomplished another one of his daring exploits near Drainesville.;;; He attacked a body of the enemy one hundred and eighty strong, routing them completely; killed fifteen, a large number wounded, and seventy prisoners, with horses, arms, equipments, &amp;c. His own loss was one killed and four slightly wounded.;;; On the 26th he attacked, with sixty men, two hundred and fifty of the enemy's cavalry, near Upperville, who retreated before him, killing six, (left on the field.) including one captain.;;; He captured one lieutenant and seven privates.;;; The road was strewn with abandoned hats, haversacks, &amp;c. Wagons were impressed by the enemy to carry off wounded.;;; His own loss was two wounded. (Signed) J. E. B. Stuart, Major General.	0.7927517890930176
1862-06-10_article_0143	The lines.;;; Nothing occurred along the lines yesterday to break the monotony of camp life and duty.;;; Both armies seen to be busy in strengthening their positions, and in making ready for the approaching conflict.;;; But little if any firing was heard in this city yesterday, and we therefore conclude that not even the usual skirmish occurred.;;; We are informed that a flag of truce, which was sent to the enemy in order to recover the bodies of some of our men, was refused admission into their lines, and that there is little hope that any bodies can be obtained.--We have heard nothing from the batteries at Wilton and Drury's Bluff, and presume all is quiet there also.	0.7911521196365356
1863-11-28_article_0045	Reported advance of the enemy on the Rapidan. Orange C. H., Nov. 27.;;; --The enemy are believed to have crossed in force at Germanna and Ely's fords.;;; Preparations are being made to meet them.;;; There has been some cannonading this morning.;;; A fight is expected in the neighborhood of the Chancellorsville battle-ground.	0.7908921241760254
1863-12-12_article_0036	The Siege of Charleston. Charleston, Dec. 11th.;;; -- Twelve shells were thrown into the city last night, at intervals of three hours. Damage trifling.--Our batteries replied.;;; No firing on Sumter.;;; [ second Dispatch.] Charleston, Dec. 11 P. M.;;; --The enemy again shelled the city at intervals during the day. Six buildings were struck, but no person injured.;;; About 9 o'clock this morning Fort Sumter took fire from some cause as yet unknown.;;; The fire communicated to some outer timber work of the southwest angle, and the wood work was burned and some ammunition destroyed.;;; There were some casualties, but the particulars have not yet been received.;;; The enemy's land batteries opened heavily on the fort during the progress of the fire, and were replied to from Moultrie and our batteries.;;; A heavy firing was kept up all day, which ceased at dark.;;; Damage to Sumter not material.	0.7907960414886475
1862-10-20_article_0001	From the army of Northern Virginia.;;; We conversed with officers last night, who left the army of Northern Virginia on Thursday last, and learned from them that our army was confronting the foe in a state of masterly inactivity — that everything was quiet along the lines and nothing on the table.;;; At a late hour last night the War Department was without anything definite from Gen. Lee, having received in dispatches of an official nature.	0.7899243235588074
1862-05-10_article_0132	From North Carolina. Wilmington May 9;;; --Pickets report the landing of Federals at Swansboro ', twenty miles south of Fort Macon, yesterday.;;; There is no force to oppose them.;;; All quiet here.	0.7898913621902466
1862-08-08_article_0001	The lines below Richmond.;;; The public seems destined to be left in blissful obscurity in regard to affairs at Malvern Hill.;;; Up to 9 o'clock last evening no official account had reached the War Office of its capture or possession by the enemy, and it is possible that all the statements to that effect are premature.;;; All the information received from that quarter seems to have been brought by parties who left the field while our troops occupied it, and before any indications of evacuation were developed.	0.7895865440368652
1862-12-05_article_0003	The fight at Lavergne, Tenn.;;; Through the politeness of a gentleman who participated in the affair, we are enabled to present to surrenders an accurate, though not a very long, account of the heavy skirmish at Lavergne, Tenn., on the 28th of November. It might rather be called an artillery duel, for the severest part of the engagement was between the artillery on other side.;;; The forces engaged were the advance of the opposing armies.;;; General Wheeler, with his brigade, was posted at Lavergne, fifteen miles beyond Murfreesboro ', and here the enemy made the attack with a much larger force consisting of cavalry and artillery.;;; The fight soon became severe, and the discharges of cannon were rapid and incessant.;;; Both sides seemed determined to drive the other off the field, or at least not to yield an inch of the disputed territory, and for some hours our troops fight with the most desperate bravery.;;; At length however, it became evident that it was useless to contend longer against a superior force, not say in numbers, but in guns, and General Wheeler slowly withdrew his command to a point four miles distant. Fortunately he was here reinforced, and rallying his men, drove the enemy back and to gained the ground he had lost.;;; It was near the nose of the fight when General Wheeler 's horse was killed by a shell, and he himself was wounded in the leg. But for this circumstance, and the lateness of the hour, the Abolition force would have been totally routed.;;; As it was, they lost nearly two hundred in killed and wounded, while our casualties are less than half that number.	0.7868951559066772
1861-04-17_article_0181	Fort Pickens supplied. Pensacola April 15.;;; --Shot and munitions have been landed at Fort Pickens by the U. S. fleet.	0.785281777381897
1862-10-02_article_0152	Capture of our sick and wounded at Warrenton.;;; A number of our sick and wounded, who were captured by the Yankees at Warrenton on Monday, and afterwards paroled, arrived in this city yesterday afternoon.;;; They that the enemy's cavalry, about one thousand strong, dashed into the town on Monday morning. They represented that they were supported by fifteen hundred infantry, but the infantry supports never made their appear We had no force at Warrenton, and, of course no resistance was made.;;; The number of sick and wounded paroled was about eight hundred.	0.7852312922477722
1862-11-18_article_0001	Yankees advancing on Fredericksburg.;;; From a gentleman who left Fredericksburg yesterday we learn that a heavy force of the enemy was advancing on that town, and that preparations were making by our forces there to give them a warm reception.;;; On Sunday a cavalry skirmish occurred some miles above the town, at a ford on the Rappahannock river, the enemy sustaining a repulse, without any casualties on our side.;;; Yesterday morning they again advanced, and were met by our cavalry near the town, and a second time repulsed.;;; In this fight we had one killed and three wounded. If the force of the enemy is as large as represented our forces there will doubtless be compelled to evacuate the place, unless early assistance should reach them.;;; Col. Ball, of the 15th Virginia cavalry, is in command of the post.;;; Our informant states that when he left Fredericksburg Falmouth (nearly opposite) was in possession of the enemy.;;; The stock of cotton and tobacco stored in Fredericksburg was burned during the day yesterday by our troops.;;; P. S.--Since the above was written we learn, on good authority, that the enemy entered Fredericksburg yesterday with two regiments.;;; A skirmish occurred with our troops, who fell back.	0.7822487354278564
1863-11-27_article_0037	The battle at Lookout Mountain. further Particulars. [from our own Correspondent] Chickamauga, Nov. 25.;;; -- General Bragg abandoned Lookout Mountain last night, as no longer tenable or important, and massed his army on Missionary Ridge.;;; Our right extended well up to the month of the Chickamauga, where the enemy had sent a heavy force.;;; Gen. Hardee commanded the right wing, and Gen. Breckinridge the left.;;; The battle commenced at ten, and became general by twelve o'clock.;;; On the right Hardee repulsed the enemy's assault with great slaughter, capturing seven flags and some prisoners, but the enemy gained a ridge near our centre and enfiladed our lines.;;; The men supposing that the enemy were successful elsewhere gave way on our left, when the Federals occupied that part of the ridge.;;; Our whole army was withdrawn at night, and is now crossing the Chickamauga.;;; There were no rails (?) by which to bring off our artillery, and in some cases several guns were lost and some prisoners.;;; Our loss in killed and wounded is slight.;;; The enemy's forces were two to our one. Sallust.	0.7803062200546265
1862-08-13_article_0022	The first Virginia regiment.;;; --The ranks of this regiment are being filled up with such material as will doubtless sustain its enviable reputation.;;; The gallant Col. Williams, who was so severely wounded at Williamsburg and fell into the hands of the enemy, has resumed command.	0.7773529291152954
1861-10-02_article_0129	The Rumored capture of Col. McDonald 's command.;;; --The Winchester Republican, of the 37th inst. says:;;; Late and reliable news from Col. McDonald 's camp gives the lie to the exaggerated rumors of the capture of his command, with his death, and that of Captain Wingfield, Sheetz, and Jordon.;;; On Tuesday morning the enemy appeared in overwhelming numbers near Romney, and opened fire upon his camp.;;; Finding that his cavalry could not be made available, owing to the peculiar locality of the country, Col. McDonald fell back six miles this side of Romney.;;; On Wednesday morning, with a considerable force of militia, together with his cavalry, he returned to drive the enemy from their position.;;; The result of this expedition we have not yet learned.	0.7770233750343323
1862-07-03_article_0023	Trophies.;;; --A number of pieces of artillery, captured from the enemy by our brave troops, passed up the street yesterday morning.;;; They were all of the very finest description, and will be turned to good account against the boasted legions of Lincoln.	0.7760629653930664
1862-11-26_article_0001	From Fredericksburg.;;; All that we heard yesterday from this town, upon which is centred the great interest of the war, was that all was quiet to a late hour in the day. There were reports that the enemy were leaving their position opposite the town, and as no active movement has taken place in front of our lines, it is not improbable that their forces are being withdrawn for embarkation at Aquia creek.;;; The condition of our men is spoken of as being good, and it is likely that Burnside was not eager to risk a fight with the army he found confronting him. The concentrated effort of the enemy will no doubt be made from the South side.	0.7755757570266724
1863-09-07_article_0011	Serious affair.;;; --The Greensboro' (N. C.) Patriot understands that on Tuesday last quite a serious affair occurred near the house of Col. Coble, of the 67th regiment militia, in the southeast part of Guilford county.;;; The particulars seem to be that a party of deserters were passing through the neighborhood, and the Colonel with a small force of his neighbors attempted to arrest them.--The deserters were armed, and regular firing ensued.;;; Two of the deserters were killed, and three captured. The others made their escape.;;; Col. Coble was slightly wounded.	0.7746784687042236
1862-11-25_article_0001	From Fredericksburg.;;; Up to a late hour in the afternoon yesterday everything was quiet at Fredericksburg, no new demonstration upon the town having been made by the enemy.;;; It is understood that the place is not to be shelled unless occupied by our forces.	0.7745508551597595
1861-09-04_article_0183	The battle of Cross Lanes.;;; --We conversed yesterday afternoon with a young gentleman who was engaged in this battle.;;; He says that our forces attacked Col. Tyler 's camp early in the morning, and dispersed the enemy in a short time.;;; Twenty-three killed were found upon the battle-ground, and fifteen other dead bodies soon afterwards discovered in the surrounding woods.;;; Col. Tyler is represented to have left the scene ingloriously at nearly moment of the engagement.;;; Our informant thinks that some two hundred and fifty prisoners had been secured when he left; and he heard, after leaving, that a number more had been brought in.	0.7743338942527771
1864-08-29_article_0051	The battle Atreams 's Petersburg, August 26.;;; --The affair on the Weldon railroad yesterday was a very gallant one, and successful in its results.;;; While the enemy's cavalry, under General Spears, were engaged in tearing up the track several miles beyond Reams 's, General Hampton attacked and forced them back behind their infantry supports.;;; General Hampton then dismounted his men and fought their infantry, gradually but steadily pushing them back until they reached their works, one mile this side of Reams 's, capturing about eight hundred prisoners.;;; At 5 o'clock in the afternoon General Hill attacked the enemy's works, and after a short but sharp fight took them, capturing a large number of prisoners and nine pieces of artillery.;;; The enemy fled in great confusion.;;; Colonel Pegram, of Richmond, turned the captured guns upon the enemy with great effect.;;; The number of prisoners will probably reach twenty-five hundred. Brigadier-General Cutler was captured.;;; The prisoners belong to Hancock 's corps, and have been brought to town.;;; There was considerable firing down the road to day but no heavy fighting.;;; Our cavalry acted with conspicuous gallantry.	0.7715913653373718
1863-03-11_article_0001	The second advance of the enemy in North Carolina.;;; The second advance of the Yankees in North Carolina has resulted as the first did, in their repulse.;;; The skirmish took place below Kinston, on Friday.;;; The enemy, it is said, lost several killed and wounded, but it is not known how many.;;; The enemy on Saturday --in what force it is not known — were at White Oak river, on the Onslow line, below Trenton, and about 21 or 22 miles from Newbern.;;; There are none known to be between Trenton and Kinston.;;; The entire force at Newbern is thought to be thirteen or fourteen regiments, probably not more than 5,000 to 6,000 effective men. We hardly think that an advance with such a force is much to be treaded.	0.7715266942977905
1861-12-24_article_0123	The Drainsville fight. Centerville, Dec. 23.;;; --You have doubtless had are this full particulars of the heavy skirmish near Drainsville on Friday.;;; While our loss was servere in killed, wounded, and missing, it is much less than the first reports authorized us to believe.;;; On Saturday, our troops took possession of Drainsville.;;; That place was occupied by the Yankees on Friday; and, when our forces approached it on Saturday, the Yankees gave good evidence of fleetness in double-quick movements out of our reach — not a gun was fired.;;; The Federals who were killed and wounded on Friday number about 300, and the Confederate loss was 50 killed, 130 wounded and 40 missing. This report is believed to be correct.;;; Several of the missing have returned to camp; and several of the wounded are regarded as seriously and perhaps mortally wounded.	0.7707505226135254
1862-06-09_article_0155	Gen. Pettigrew not dead.;;; From a flag of truce which communicated with the enemy on Friday we learn that Gen. Pettigrew was not killed as at first reported, but that he was wounded and a prisoner of war. His captures was swing to his own while wounded on the field, be commanded those who were hearing him off to return to their posts and leave him to his fate.;;; His wound, although serious, is reported as doing well Col. Lightfoot and Lt. Col. Long, of the Twenty-Second North Carolina, were also supposed to be among the killed; but we have learned by the flag of truce that they were neither injured in the battle, and that they are now prisoners in the Federal army.	0.7705709934234619
1863-04-27_article_0039	From Northern Mississippi. Okolona April 15;;; --Our cavalry engaged the enemy yesterday at Birmingham.;;; The fight lasted two hours and a half. The enemy were completely routed.;;; Fifteen were killed and a large number wounded Col. Hatch, of the 24 Iowa cavalry, was seen to fall from his horse, which ran into our lines and was captured.;;; Our loss was one killed and twenty wounded. The destruction of a bridge prevented pursuit.	0.7683694362640381
1863-11-02_article_0013	More Greek fire.;;; -- One of the shells thrown into Charleston, on Tuesday, was picked up Wednesday morning unexploded, and the contents withdrawn, when it was found to contain the celebrated Greek fire.	0.7679821848869324
1861-05-18_article_0060	North Carolina troops.;;; The forces of North Carolina, in large numbers, are said to be concentrated at Weldon, ready to advance, at a moment's warning, to any point in Virginia where their services may be needed.	0.7672268748283386
1861-12-19_article_0197	Liberal Contribution.;;; --We learn, from able authority, that the 4th North Caro-Virginia State troops, ( Col. Anderson 's Regiment,) have subscribed onwards of $1,000 for the relief of the sufferers of the Charleston conflagration.	0.7668744921684265
1862-07-19_article_0103	The enemy's movements.;;; Reports continue to reach us of the movements of the enemy in the vicinity of the Rapidan.;;; It was stated yesterday that several regiments of infantry and a squadron of cavalry were on this side of the river; and that the waters had suddenly rises, rendering it impossible to recross by fording.;;; It was thought probable that an attempt would be made to keep open communication with the main body of the Federal army by means of a bridge at a point some distance from the railroad station, but with what prospect of success we are unable to say.	0.7667968273162842
1862-08-07_article_0001	Skirmishing below Richmond.;;; On Tuesday last a body of the enemy, about 3,000 strong, consisting of infantry, artillery, and cavalry, drove in our videttes to White Oak Swamp bridge, where they were held in check during the day by the 10th cavalry regiment, under command of Lieut. Col. McGruder.;;; Some ten of our videttes are missing, though it is believed that most of them will return to camp.;;; Two of the enemy's cavalry were killed by the pickets in their retreat.;;; Yesterday our scouts reported that the enemy had fallen back three miles beyond the bridge.;;; Seven prisoners were brought in by the scouts, and one of them, who seems to be an intelligent man, states that McClellan has not more than 55,000 men; that sickness is alarmingly thinning their ranks, and that on Monday afternoon last three divisions, under command of Gens. Harney, Sedgwick, and Hooker with rations for two days, left Harrison's Landing for the purpose of taking Malvern Hill, which they supposed was held by the Confederates with a strong force.;;; This may explain why our entire picket line was kept in expectation of an attack, so that no reinforcements would be sent to Malvern Hill.;;; The Yankees, however, were somewhat disappointed in their anticipations of a brilliant victory.;;; With reference to the fight at Malvern Hill, on Tuesday, we learn that our notice of yesterday was in the main correct, our forces having been driven from that position.;;; It is not certain that any attempt was yesterday made to regain the hill by our troops.;;; One report states that a force was sent down, and after a brisk fight was repulsed, whilst another represents that the position was recovered without serious opposition.;;; It is more than probable, from information received late last evening that our forces are again in possession of the hill.	0.7647404074668884
