id	text	T06
1861-02-19_article_0008	Virginia Post-office affairs.;;; --A new office is established at Mountain Falls, Frederick county, and David Cooper appointed postmaster; near the route from Winchester to Wardensville.;;; The office at Fisher's Point, Jackson county, is re-established, and James D. Thomas appointed postmaster.;;; Appointments. -- Napoleon B. Richardson postmaster at Fife's, Goochland county, vice Jane Poor, deceased.;;; Joseph F. Howard postmaster at Issequina, Goochland county, vice John P. Bradley, moved away.;;; E. T. Ogg postmaster at Bells X Ronds, Louisa county, vice R. H. Ogg, resigned.;;; William Dawson postmaster at Cypress Island, Alleghany county, vice J. A. Thomas, resigned.;;; C. A. Kramer postmaster at Fort Martin, Monongalia county, vice Joseph Snyder, resigned.;;; Edward Pritchard postmaster at Shirley, Tyler county, vice W. W. Clark, resigned.;;; Local Matters.	0.5995906591415405
1861-02-02_article_0134	Post-office affairs.;;; -- Virginia -- The site of Forks, Washington county, Va., is changed to Grant's Store, midway between Forks and Bluff Bridge, and Gardner Grantappointed postmaster.;;; Office at Bluff Bridge, Washington county, Va., is discontinued. Appointments. -- Lucien A. Hagans postmaster at Brandonville, Prestoncounty, vice Samuel Forquer, removed.;;; Seth W. Cobb, postmaster at Franklin Depot, Southampton county. Va., vice Robert J. Neely, resigned.;;; Daniel M. Shinn, postmaster at Shinnston, Harrisoncounty, Va., vice Peter Davis, resigned. E. B, Hitton, postmaster at Fulkerson, Scottcounty, Va., vice John H. Hilton, resigned.	0.5989686250686646
1861-04-15_article_0023	Post-office affairs in Virginia.;;; -- John L. Thompson, postmaster at Ashland, Hanover county, vice James W. Taylor, resigned. -- Wm. P. Recker, postmaster at Covington, Alleghany county, vice James Burke.;;; James M. Costolo, postmaster at Evansville, Preston county, vice Theo. H. Kidd, declined.;;; Local Matters.	0.5838197469711304
1861-02-15_advert_0010	Henry Coalter Cabell.;;; J. H. Sands.;;; Cabell &amp; Sands,;;; Attorney and;;; Counsellors at Law.;;; Richmond, Va.,;;; Practice in the Supreme Court of Appeals of Virginia, and in all the Courts of the city of Richmond and counties of Henrico and Chesterfield.;;; Office, three doors below the Exchange Bank, Main street, between 11th and 12th streets.;;; no 23 --3m	0.5805627703666687
1860-11-10_article_0029	Post-Office affairs;;; -- Appointment's in Virginia. -- William P. Jones postmaster at Northwest River Bridge, Norfolk county, Va., vice Thomas C. Holt, resigned.;;; Simon H. Bach, postmaster at Roaring Run, Botetourt county vice James J. Painter, resigned.;;; Jacob A. Lantz, postmaster at Mole Hill, Ritchie county, Va., vice Rachel Reed, resigned.;;; Francis R. Elliott, postmaster at Wayland, Scott county, Va., vice C. C. Elliott, resigned.;;; Mary E. McNeil, postmaster at Perryville, McDowell county, Va., vice William R. Lee, resigned.-- John F. Martin, postmaster at Irisburg, Henry county, Va., vice James Semple, resigned.	0.579800546169281
1861-02-21_article_0156	Post-office affairs;;; -- Railroad line, Wilmington, N. C. to Manchester, Robert M. Houston is appointed route agent, vice C. W. Hawes, declined.;;; Office at Mount Landing, Essex county, Va., is established, and Archibald R. Rowzie is appointed postmaster.;;; At Johnson's Cross Roads, Monroe co., Va. Jas. W. Johnson is appointed postmaster, vice A. C. Scott, resigned.	0.5754713416099548
1861-10-09_entry_0090	We are requested to announce that Hon. D. C. D. Jarnette, of Caroline, is a candidate to represent the District composed of the counties of Caroline, Louisa, Spotsylvania, King George, Stafford, Orange, Greene, Madison, and Culpeper, in the first Congress of the Confederate States.;;; se 30--1nt	0.5737433433532715
1862-06-30_article_0046	John Huffman, of Shenandoah county, Va., was killed by a kick from a horse on the 1st of June.	0.5724115967750549
1860-11-12_article_0083	"The returns.;;; Below we publish a table containing all the returns received since Saturday morning, and some official corrections of the vote as published then:;;; Breckinridge 's makers Bell 's Majorities.;;; Accomac tie. Albemarle 261;;; Alleghany 101 Alexandria 446;;; Amherst 175 Amelia 21;;; Appomattox 342 Augusta 2330;;; Barbour 587 Bath 57;;; Brooke 278 Berkeley 83;;; Brunswick 186 Botetourt 1;;; Caroline 211 Bedford 429;;; Carroll 378 Buckingham 22;;; Charlotte 47 Campbell 314;;; Clarke 47 Chesterfield 456;;; Cumberland 3 Culpeper 1;;; Doddridge 204 Charles City 814;;; Essex 29 Dinwiddie 135;;; Fauquier 47 Elizabeth City 83;;; Franklin 213 Fairfax 7;;; Frederick 352 Fluvanna 32;;; Floyd 35 Greenbrier 490;;; Gloucester 164 Hardy 510;;; Goochland 189 Henry 99;;; Greene 457 Highland 47;;; Gilmer 160 Henrico 700;;; Greensville 13 James City 88;;; Hampshire 184 Jefferson 501;;; Halitax 766 Londoun 1253;;; Hancock 200 Marshall 117;;; Harrison 260 Monroe 175;;; Isle of Wight 609 Montgomery 287;;; King George 42 Nansemond 58;;; King and Queen 256 Nelson 336;;; King William 173 New Kent 94;;; Lewis 355 Norfolk City 547;;; Lunenburg 275 Norfolk county 255;;; Madison 760 Northampton 20;;; Mecklenburg 471 Nottoway 57;;; Marion 768 Ohio 285;;; Matthews 57 Petersburg 747;;; Northumberland 74 Portsmouth 118;;; Orange 48 Powhatan 98;;; page 796 Prince George 52;;; Pleasants 23 Princess Anne 72;;; Prince Edward 47 Pitisylvania 645;;; Prince William 479 Pulaski 82;;; Ritchie 320 Rappahannock 80;;; Roanoke 80 Richmond City 1234;;; Shenandoah 1440 Rockbridge 892;;; Smyth 50 Rockingham 206;;; Southampton 23 Spotsylvania 187;;; Tyler 100 Stafford 1;;; Upshur 230 Surry 74;;; Warren 186 Taylor 72;;; Washington 280 Warwick 49;;; Wetzel 549 Westmoreland 344;;; Wood tie Williamsburg 6;;; Wythe 177;;; 15,631;;; 14,245 14,245;;; majority for Bell 1,386;;; the following table shows the vote in 1859, in the counties yet to be heard from:;;; Letcher. Goggin.;;; Boone 142 Braxton 32;;; Buchanan 91 Clay 41;;; Cabell 91 Giles 111;;; Calhoun 251 Kanawha 671;;; Craig 164 Lancaster 49;;; Fayette 39 Lee 64;;; Grayson 113 Louisa 99;;; Hanover 117 Mason 141;;; Jackson 122 McDowell 82;;; Logan 386 Mercer 128;;; Middlesex 35 Morgan 13;;; Patrick 90 Nicholas 61;;; Pendleton 28 Putnam 24;;; Pocahontas 285 Raieigh 233;;; Preston 305 Richmond county 35;;; Randolph 204 Roane 41;;; Sussex 164 Russell 317;;; Tazewell 80 Scott 41;;; Tucker 159 Wyoming 93;;; Wayne 51 York 69;;; Webster.;;; (new co.);;; Wirt 166;;; Wise 18;;; 3,101 2,375;;; 2,375;;; 726;;; Bell 's maj. in the co's heard from 1,386;;; Bell 's clear maj 660;;; Should the counties above vote precisely as in 1859, Mr. Bell would have a clear majority of 660.;;; But in Russell county, a telegram states that the Democratic gain is reported at nearly 500, and Scott, Grayson, Lee, and other counties in ""Little Tennessee,"" are reported by telegraph to have given large gains for the same party.;;; In Kanawha, it is stated by telegraph that Bell gains 200 over the vote of ' 59.;;; The table of the Presidential election includes 110 counties, nearly every one of which are reported by the Clerks of the County Courts, and may therefore be considered as reliable.--Many unreliable returns have been received but were rejected in making it up."	0.5634238123893738
1861-02-28_article_0097	Post-office Affairs.;;; --On the railroad line from Augusta to Columbia, S. C., Mr. Perry Moses is appointed route agent, in place of F. J. Crum, deceased.;;; At Wellsburg, Brooke county, Va., Thomas M. Lloyd is appointed postmaster, vice Wm. D. Camp. Thomas F. Kemble is appointed postmaster at Prunity Town, Taylor county, Va., vice Abraham Smith.	0.5615466833114624
1861-07-23_article_0136	Geo. S. Stevenson, Esq., a prominent lawyer, died at Newbern, N, C., last Week,	0.556709885597229
1863-11-18_article_0047	A deserter named Samuel Webs, was shot and killed a few days since in Franklin county, Va., by one of the Provost Guard of the county.	0.5510836839675903
1860-11-10_article_0036	Freshet.;;; --On Thursday, Friday and Saturday, of last week, Shenandoah county, Va., was visited by the heaviest rains that have fallen for six months. The North branch of the Shenandoah, and its tributaries, overflowed their banks in many localities, and the crops of corn have been considerably damaged.;;; Wheat, in the bottom lands, was also injured to some extent.	0.5508982539176941
1861-10-15_article_0190	We are requested to announce that Hon. D. C. Dejarnette, of Caroline, is a candidate to represent the District composed of the counties of Caroline, Louisa, Spotsylvania, King George, Stafford, Orange, Greene, Madison, and Culpeper, in the first Congress of the Confederate States.;;; se 30 --1m*;;; Professional Cards.	0.5492410063743591
